{"$schema":"https://json-schema.org/draft/2020-12/schema","type":"object","additionalProperties":false,"required":["schemaVersion","passed","totalCount","failedCount","skippedCount","pesterVersion","reportSha256","coveragePercent","coverageTarget","coverageReportSha256","fixture","analyzerPassed","commitSha"],"properties":{"schemaVersion":{"const":1},"passed":{"const":true},"totalCount":{"type":"integer","minimum":1},"failedCount":{"const":0},"skippedCount":{"const":0},"pesterVersion":{"const":"5.7.1"},"reportSha256":{"type":"string","pattern":"^[A-Fa-f0-9]{64}$"},"coveragePercent":{"type":"number","minimum":85,"maximum":100},"coverageTarget":{"const":85},"coverageReportSha256":{"type":"string","pattern":"^[A-Fa-f0-9]{64}$"},"fixture":{"type":"boolean"},"analyzerPassed":{"type":"boolean"},"commitSha":{"type":"string","pattern":"^[A-Fa-f0-9]{40}$"}}}
