{"schemaVersion":1,"passed":true,"totalCount":1,"failedCount":0,"skippedCount":0,"pesterVersion":"5.7.1","reportSha256":"0000000000000000000000000000000000000000000000000000000000000000","coveragePercent":100,"coverageTarget":85,"coverageReportSha256":"0000000000000000000000000000000000000000000000000000000000000000","fixture":true,"analyzerPassed":false,"commitSha":"ce34e00b8ed56109b09faab27fba39046e886d2d"}
